Ether / IP / TCP 13.89.179.11:https > 192.168.29.94:54600 A / Padding
Ether / IP / TCP 13.89.179.11:https > 192.168.29.94:54600 A / Padding
Ether / IP / TCP 13.89.179.11:https > 192.168.29.94:54600 PA / Raw
Ether / IP / TCP 192.168.29.94:54600 > 13.89.179.11:https A
Ether / IP / TCP 13.89.179.11:https > 192.168.29.94:54600 PA / Raw
Ether / IP / TCP 192.168.29.94:54600 > 13.89.179.11:https A
Ether / IP / TCP 192.168.29.94:50143 > 20.42.65.93:https S
Ether / IP / TCP 192.168.29.94:50144 > 20.42.65.93:https S
Ether / IP / TCP 192.168.29.94:50145 > 20.42.65.93:https S
Ether / IPv6 / UDP / DNS Qry b'mobile.events.data.microsoft.com.'
Ether / IP / TCP 192.168.29.94:50146 > 20.42.65.93:https S
Ether / IP / TCP 192.168.29.94:50147 > 20.42.65.93:https S
Ether / IP / TCP 192.168.29.94:50148 > 20.42.65.93:https S
Ether / IP / UDP / DNS Qry b'mobile.events.data.microsoft.com.'
Ether / IPv6 / UDP / DNS Ans b'mobile.events.data.trafficmanager.net.'
Ether / IP / TCP 20.42.65.93:https > 192.168.29.94:50144 SA
Ether / IP / TCP 20.42.65.93:https > 192.168.29.94:50143 SA
Ether / IP / UDP / DNS Ans b'mobile.events.data.trafficmanager.net.'
Ether / IP / TCP 192.168.29.94:50144 > 20.42.65.93:https A
Ether / IP / TCP 192.168.29.94:50143 > 20.42.65.93:https A
Ether / IP / TCP 192.168.29.94:50144 > 20.42.65.93:https PA / Raw
Ether / IP / TCP 192.168.29.94:50143 > 20.42.65.93:https PA / Raw
Ether / IP / TCP 192.168.29.94:50149 > 20.42.65.93:https S
Ether / IP / TCP 192.168.29.94:50150 > 20.42.65.93:https S
Ether / IP / TCP 192.168.29.94:50151 > 20.42.65.93:https S
Ether / IP / TCP 192.168.29.94:50152 > 20.42.65.93:https S
Ether / IP / TCP 192.168.29.94:50153 > 20.42.65.93:https S
Ether / IP / TCP 20.42.65.93:https > 192.168.29.94:50145 SA
Ether / IP / TCP 192.168.29.94:50145 > 20.42.65.93:https A
Ether / IP / TCP 192.168.29.94:50145 > 20.42.65.93:https PA / Raw
Ether / IP / TCP 20.42.65.93:https > 192.168.29.94:50147 SA
Ether / IP / TCP 20.42.65.93:https > 192.168.29.94:50146 SA
Ether / IP / TCP 20.42.65.93:https > 192.168.29.94:50148 SA
Ether / IP / TCP 192.168.29.94:50147 > 20.42.65.93:https A
Ether / IP / TCP 192.168.29.94:50146 > 20.42.65.93:https A
Ether / IP / TCP 192.168.29.94:50148 > 20.42.65.93:https A
Ether / IP / TCP 192.168.29.94:50147 > 20.42.65.93:https PA / Raw
Ether / IP / TCP 192.168.29.94:50146 > 20.42.65.93:https PA / Raw
Ether / IP / TCP 192.168.29.94:50148 > 20.42.65.93:https PA / Raw
Ether / IP / TCP 20.42.65.93:https > 192.168.29.94:50149 SA
Ether / IP / TCP 20.42.65.93:https > 192.168.29.94:50144 PA / Raw
Ether / IP / TCP 192.168.29.94:50149 > 20.42.65.93:https A
Ether / IP / TCP 192.168.29.94:50144 > 20.42.65.93:https PA / Raw
Ether / IP / TCP 192.168.29.94:50149 > 20.42.65.93:https PA / Raw
Ether / IP / TCP 20.42.65.93:https > 192.168.29.94:50143 PA / Raw
Ether / IP / TCP 20.42.65.93:https > 192.168.29.94:50151 SA
Ether / IP / TCP 192.168.29.94:50151 > 20.42.65.93:https A
Ether / IP / TCP 192.168.29.94:50143 > 20.42.65.93:https PA / Raw
Ether / IP / TCP 192.168.29.94:50151 > 20.42.65.93:https PA / Raw
Ether / IP / TCP 20.42.65.93:https > 192.168.29.94:50150 SA
Ether / IP / TCP 192.168.29.94:50150 > 20.42.65.93:https A
Ether / IP / TCP 192.168.29.94:50150 > 20.42.65.93:https PA / Raw
Ether / IP / TCP 20.42.65.93:https > 192.168.29.94:50152 SA
Ether / IP / TCP 192.168.29.94:50152 > 20.42.65.93:https A
Ether / IP / TCP 192.168.29.94:50152 > 20.42.65.93:https PA / Raw
Ether / IP / TCP 20.42.65.93:https > 192.168.29.94:50153 SA
Ether / IP / TCP 192.168.29.94:50153 > 20.42.65.93:https A
Ether / IP / TCP 192.168.29.94:50153 > 20.42.65.93:https PA / Raw
Ether / IP / TCP 20.42.65.93:https > 192.168.29.94:50145 PA / Raw
Ether / IP / TCP 192.168.29.94:50145 > 20.42.65.93:https PA / Raw
Ether / IP / TCP 20.42.65.93:https > 192.168.29.94:50147 PA / Raw
Ether / IP / TCP 192.168.29.94:50147 > 20.42.65.93:https PA / Raw
Ether / IP / TCP 20.42.65.93:https > 192.168.29.94:50146 PA / Raw
Ether / IP / TCP 192.168.29.94:50146 > 20.42.65.93:https PA / Raw
Ether / IP / TCP 20.42.65.93:https > 192.168.29.94:50148 PA / Raw
Ether / IP / TCP 192.168.29.94:50148 > 20.42.65.93:https PA / Raw
Ether / IP / TCP 20.42.65.93:https > 192.168.29.94:50149 PA / Raw
Ether / IP / TCP 192.168.29.94:50149 > 20.42.65.93:https PA / Raw
Ether / IP / TCP 20.42.65.93:https > 192.168.29.94:50144 A / Raw
Ether / IP / TCP 20.42.65.93:https > 192.168.29.94:50144 A / Raw
Ether / IP / TCP 20.42.65.93:https > 192.168.29.94:50144 A / Raw
Ether / IP / TCP 20.42.65.93:https > 192.168.29.94:50144 A / Raw
Ether / IP / TCP 20.42.65.93:https > 192.168.29.94:50144 PA / Raw
Ether / IP / TCP 192.168.29.94:50144 > 20.42.65.93:https A
Ether / IP / TCP 192.168.29.94:50144 > 20.42.65.93:https A / Raw
Ether / IP / TCP 192.168.29.94:50144 > 20.42.65.93:https PA / Raw
Ether / IP / TCP 20.42.65.93:https > 192.168.29.94:50143 A / Raw
Ether / IP / TCP 20.42.65.93:https > 192.168.29.94:50143 PA / Raw
Ether / IP / TCP 20.42.65.93:https > 192.168.29.94:50151 PA / Raw
Ether / IP / TCP 192.168.29.94:50143 > 20.42.65.93:https A
Ether / IP / TCP 192.168.29.94:50143 > 20.42.65.93:https A / Raw
Ether / IP / TCP 192.168.29.94:50143 > 20.42.65.93:https A / Raw
Ether / IP / TCP 192.168.29.94:50143 > 20.42.65.93:https A / Raw
Ether / IP / TCP 192.168.29.94:50143 > 20.42.65.93:https PA / Raw
Ether / IP / TCP 192.168.29.94:50151 > 20.42.65.93:https PA / Raw
Ether / IP / TCP 192.168.29.94:54600 > 13.89.179.11:https PA / Raw
Ether / IP / TCP 192.168.29.94:54600 > 13.89.179.11:https A / Raw
Ether / IP / TCP 192.168.29.94:54600 > 13.89.179.11:https PA / Raw
Ether / IP / TCP 20.42.65.93:https > 192.168.29.94:50145 A / Raw
Ether / IP / TCP 20.42.65.93:https > 192.168.29.94:50152 PA / Raw
Ether / IP / TCP 20.42.65.93:https > 192.168.29.94:50145 PA / Raw
Ether / IP / TCP 20.42.65.93:https > 192.168.29.94:50150 PA / Raw
Ether / IP / TCP 20.42.65.93:https > 192.168.29.94:50153 PA / Raw
Ether / IP / TCP 192.168.29.94:50145 > 20.42.65.93:https A
Ether / IP / TCP 192.168.29.94:50152 > 20.42.65.93:https PA / Raw
Ether / IP / TCP 192.168.29.94:50150 > 20.42.65.93:https PA / Raw
Ether / IP / TCP 192.168.29.94:50153 > 20.42.65.93:https PA / Raw
Ether / IP / TCP 192.168.29.94:50145 > 20.42.65.93:https A / Raw
Ether / IP / TCP 192.168.29.94:50145 > 20.42.65.93:https PA / Raw
Ether / IP / TCP 20.42.65.93:https > 192.168.29.94:50147 A / Raw
Ether / IP / TCP 20.42.65.93:https > 192.168.29.94:50147 PA / Raw
Ether / IP / TCP 192.168.29.94:50147 > 20.42.65.93:https A
Ether / IP / TCP 192.168.29.94:50147 > 20.42.65.93:https A / Raw
Ether / IP / TCP 192.168.29.94:50147 > 20.42.65.93:https PA / Raw
Ether / IP / TCP 20.42.65.93:https > 192.168.29.94:50149 A / Raw
Ether / IP / TCP 20.42.65.93:https > 192.168.29.94:50149 PA / Raw
Ether / IP / TCP 20.42.65.93:https > 192.168.29.94:50146 A / Raw
Ether / IP / TCP 192.168.29.94:50149 > 20.42.65.93:https A
Ether / IP / TCP 192.168.29.94:50149 > 20.42.65.93:https A / Raw
Ether / IP / TCP 192.168.29.94:50149 > 20.42.65.93:https PA / Raw
Ether / IP / TCP 20.42.65.93:https > 192.168.29.94:50146 A / Raw
Ether / IP / TCP 20.42.65.93:https > 192.168.29.94:50146 A / Raw
Ether / IP / TCP 20.42.65.93:https > 192.168.29.94:50146 A / Raw
Ether / IP / TCP 20.42.65.93:https > 192.168.29.94:50146 PA / Raw
Ether / IP / TCP 192.168.29.94:50146 > 20.42.65.93:https A
Ether / IP / TCP 192.168.29.94:50146 > 20.42.65.93:https A / Raw
Ether / IP / TCP 192.168.29.94:50146 > 20.42.65.93:https PA / Raw
Ether / IP / TCP 20.42.65.93:https > 192.168.29.94:50148 A / Raw
Ether / IP / TCP 20.42.65.93:https > 192.168.29.94:50148 A / Raw
Ether / IP / TCP 20.42.65.93:https > 192.168.29.94:50148 A / Raw
Ether / IP / TCP 20.42.65.93:https > 192.168.29.94:50148 A / Raw
Ether / IP / TCP 20.42.65.93:https > 192.168.29.94:50148 PA / Raw
Ether / IP / TCP 192.168.29.94:50148 > 20.42.65.93:https A
Ether / IP / TCP 192.168.29.94:50148 > 20.42.65.93:https A / Raw
Ether / IP / TCP 192.168.29.94:50148 > 20.42.65.93:https PA / Raw
Ether / IPv6 / TCP 2606:4700:9ae1:d9b4:86dd:db2:ccf5:ac50:https > 2405:201:c006:90ae:4d4e:b515:9462:e106:53053 PA / Raw
Ether / IPv6 / TCP 2405:201:c006:90ae:4d4e:b515:9462:e106:53053 > 2606:4700:9ae1:d9b4:86dd:db2:ccf5:ac50:https PA / Raw
Ether / IP / TCP 20.42.65.93:https > 192.168.29.94:50144 A
Ether / IP / TCP 20.42.65.93:https > 192.168.29.94:50144 PA / Raw
Ether / IPv6 / TCP 2606:4700:9ae1:d9b4:86dd:db2:ccf5:ac50:https > 2405:201:c006:90ae:4d4e:b515:9462:e106:53053 A
Ether / IP / TCP 20.42.65.93:https > 192.168.29.94:50144 FPA / Raw
Ether / IP / TCP 192.168.29.94:50144 > 20.42.65.93:https A
Ether / IP / TCP 192.168.29.94:50144 > 20.42.65.93:https PA / Raw
Ether / IP / TCP 192.168.29.94:50144 > 20.42.65.93:https FA
Ether / IP / TCP 20.42.65.93:https > 192.168.29.94:50143 PA / Raw
Ether / IP / TCP 20.42.65.93:https > 192.168.29.94:50143 A
Ether / IP / TCP 20.42.65.93:https > 192.168.29.94:50143 FPA / Raw
Ether / IP / TCP 192.168.29.94:50143 > 20.42.65.93:https A
Ether / IP / TCP 192.168.29.94:50143 > 20.42.65.93:https PA / Raw
Ether / IP / TCP 192.168.29.94:50143 > 20.42.65.93:https FA
Ether / IP / TCP 20.42.65.93:https > 192.168.29.94:50151 A / Raw
Ether / IP / TCP 20.42.65.93:https > 192.168.29.94:50151 PA / Raw
Ether / IP / TCP 192.168.29.94:50151 > 20.42.65.93:https A
Ether / IP / TCP 192.168.29.94:50151 > 20.42.65.93:https A / Raw
Ether / IP / TCP 192.168.29.94:50151 > 20.42.65.93:https PA / Raw
Ether / IP / TCP 13.89.179.11:https > 192.168.29.94:54600 A / Padding
Ether / IP / TCP 13.89.179.11:https > 192.168.29.94:54600 PA / Raw
Ether / IP / TCP 192.168.29.94:54600 > 13.89.179.11:https PA / Raw
Ether / IP / TCP 20.42.65.93:https > 192.168.29.94:50145 A
Ether / IP / TCP 20.42.65.93:https > 192.168.29.94:50145 PA / Raw
Ether / IP / TCP 20.42.65.93:https > 192.168.29.94:50145 FPA / Raw
Ether / IP / TCP 192.168.29.94:50145 > 20.42.65.93:https A
Ether / IP / TCP 192.168.29.94:50145 > 20.42.65.93:https PA / Raw
Ether / IP / TCP 192.168.29.94:50145 > 20.42.65.93:https FA
Ether / IP / TCP 20.42.65.93:https > 192.168.29.94:50152 A / Raw
Ether / IP / TCP 20.42.65.93:https > 192.168.29.94:50152 A / Raw
Ether / IP / TCP 20.42.65.93:https > 192.168.29.94:50152 A / Raw
Ether / IP / TCP 20.42.65.93:https > 192.168.29.94:50152 A / Raw
Ether / IP / TCP 20.42.65.93:https > 192.168.29.94:50152 PA / Raw
Ether / IP / TCP 192.168.29.94:50152 > 20.42.65.93:https A
Ether / IP / TCP 192.168.29.94:50152 > 20.42.65.93:https A / Raw
Ether / IP / TCP 192.168.29.94:50152 > 20.42.65.93:https PA / Raw
Ether / IP / TCP 20.42.65.93:https > 192.168.29.94:50150 A / Raw
Ether / IP / TCP 20.42.65.93:https > 192.168.29.94:50150 PA / Raw
Ether / IP / TCP 20.42.65.93:https > 192.168.29.94:50147 A
Ether / IP / TCP 20.42.65.93:https > 192.168.29.94:50153 A / Raw
Ether / IP / TCP 192.168.29.94:50150 > 20.42.65.93:https A
Ether / IP / TCP 192.168.29.94:50153 > 20.42.65.93:https A
Ether / IP / TCP 192.168.29.94:50150 > 20.42.65.93:https A / Raw
Ether / IP / TCP 192.168.29.94:50150 > 20.42.65.93:https PA / Raw
Ether / IP / TCP 20.42.65.93:https > 192.168.29.94:50153 A / Raw
Ether / IP / TCP 20.42.65.93:https > 192.168.29.94:50153 PA / Raw
Ether / IP / TCP 20.42.65.93:https > 192.168.29.94:50147 PA / Raw
Ether / IP / TCP 20.42.65.93:https > 192.168.29.94:50147 FPA / Raw
Ether / IP / TCP 192.168.29.94:50153 > 20.42.65.93:https A
Ether / IP / TCP 192.168.29.94:50147 > 20.42.65.93:https A
Ether / IP / TCP 192.168.29.94:50153 > 20.42.65.93:https A / Raw
Ether / IP / TCP 192.168.29.94:50153 > 20.42.65.93:https PA / Raw
Ether / IP / TCP 192.168.29.94:50147 > 20.42.65.93:https PA / Raw
Ether / IP / TCP 192.168.29.94:50147 > 20.42.65.93:https FA
Ether / IP / TCP 20.42.65.93:https > 192.168.29.94:50149 A
Ether / IP / TCP 20.42.65.93:https > 192.168.29.94:50149 PA / Raw
Ether / IP / TCP 20.42.65.93:https > 192.168.29.94:50149 FPA / Raw
Ether / IP / TCP 192.168.29.94:50149 > 20.42.65.93:https A
Ether / IP / TCP 192.168.29.94:50149 > 20.42.65.93:https PA / Raw
Ether / IP / TCP 192.168.29.94:50149 > 20.42.65.93:https FA
Ether / IP / TCP 140.82.114.22:https > 192.168.29.94:50090 PA / Raw
Ether / IP / TCP 140.82.114.22:https > 192.168.29.94:50090 FA
Ether / IP / TCP 192.168.29.94:50090 > 140.82.114.22:https A
Ether / IP / TCP 20.42.65.93:https > 192.168.29.94:50146 A
Ether / IP / TCP 20.42.65.93:https > 192.168.29.94:50148 A
Ether / IP / TCP 20.42.65.93:https > 192.168.29.94:50148 PA / Raw
Ether / IP / TCP 20.42.65.93:https > 192.168.29.94:50146 PA / Raw
Ether / IP / TCP 20.42.65.93:https > 192.168.29.94:50144 A
Ether / IP / TCP 20.42.65.93:https > 192.168.29.94:50143 A
Ether / IP / TCP 192.168.29.94:50148 > 20.42.65.93:https A
Ether / IP / TCP 192.168.29.94:50146 > 20.42.65.93:https A
Ether / IP / TCP 20.42.65.93:https > 192.168.29.94:50151 A
Ether / IP / TCP 20.42.65.93:https > 192.168.29.94:50151 PA / Raw
Ether / IP / TCP 20.42.65.93:https > 192.168.29.94:50148 FPA / Raw
Ether / IP / TCP 192.168.29.94:50148 > 20.42.65.93:https A
Ether / IP / TCP 192.168.29.94:50148 > 20.42.65.93:https PA / Raw
Ether / IP / TCP 192.168.29.94:50148 > 20.42.65.93:https FA
Ether / IP / TCP 20.42.65.93:https > 192.168.29.94:50147 A
Ether / IP / TCP 20.42.65.93:https > 192.168.29.94:50146 FPA / Raw
Ether / IP / TCP 192.168.29.94:50146 > 20.42.65.93:https A
Ether / IP / TCP 192.168.29.94:50146 > 20.42.65.93:https PA / Raw
Ether / IP / TCP 192.168.29.94:50146 > 20.42.65.93:https FA
Ether / IP / TCP 20.42.65.93:https > 192.168.29.94:50149 A
Ether / IP / TCP 13.89.179.11:https > 192.168.29.94:54600 A / Padding
Ether / IP / TCP 20.42.65.93:https > 192.168.29.94:50145 A
Ether / IP / TCP 192.168.29.94:50151 > 20.42.65.93:https A
Ether / IP / TCP 20.42.65.93:https > 192.168.29.94:50152 A
Ether / IP / TCP 20.42.65.93:https > 192.168.29.94:50152 PA / Raw
Ether / IP / TCP 20.42.65.93:https > 192.168.29.94:50152 FPA / Raw
Ether / IP / TCP 20.42.65.93:https > 192.168.29.94:50150 A
Ether / IP / TCP 20.42.65.93:https > 192.168.29.94:50150 PA / Raw
Ether / IP / TCP 20.42.65.93:https > 192.168.29.94:50153 A
Ether / IP / TCP 20.42.65.93:https > 192.168.29.94:50153 PA / Raw
Ether / IP / TCP 20.42.65.93:https > 192.168.29.94:50153 FPA / Raw
Ether / IP / TCP 20.42.65.93:https > 192.168.29.94:50150 FPA / Raw
Ether / IP / TCP 192.168.29.94:50152 > 20.42.65.93:https A
Ether / IP / TCP 192.168.29.94:50150 > 20.42.65.93:https A
Ether / IP / TCP 192.168.29.94:50153 > 20.42.65.93:https A
Ether / IP / TCP 192.168.29.94:50150 > 20.42.65.93:https PA / Raw
Ether / IP / TCP 192.168.29.94:50152 > 20.42.65.93:https PA / Raw
Ether / IP / TCP 192.168.29.94:50153 > 20.42.65.93:https PA / Raw
Ether / IP / TCP 192.168.29.94:50150 > 20.42.65.93:https FA
Ether / IP / TCP 192.168.29.94:50152 > 20.42.65.93:https FA
Ether / IP / TCP 192.168.29.94:50153 > 20.42.65.93:https FA
Ether / IP / TCP 20.42.65.93:https > 192.168.29.94:50148 A
Ether / IP / TCP 20.42.65.93:https > 192.168.29.94:50146 A
Ether / IP / TCP 20.42.65.93:https > 192.168.29.94:50150 A
Ether / IP / TCP 20.42.65.93:https > 192.168.29.94:50152 A
Ether / IP / TCP 20.42.65.93:https > 192.168.29.94:50153 A
Ether / IP / TCP 20.42.65.93:https > 192.168.29.94:50151 FPA / Raw
Ether / IP / TCP 192.168.29.94:50151 > 20.42.65.93:https A
Ether / IP / TCP 192.168.29.94:50151 > 20.42.65.93:https PA / Raw
Ether / IP / TCP 192.168.29.94:50151 > 20.42.65.93:https FA
Ether / IPv6 / TCP 2405:201:c006:90ae:4d4e:b515:9462:e106:65390 > 2600:140f:6::1729:ba29:https A / Raw
Ether / IPv6 / TCP 2600:140f:6::1729:ba29:https > 2405:201:c006:90ae:4d4e:b515:9462:e106:65390 A
Ether / IP / TCP 20.42.65.93:https > 192.168.29.94:50151 A
Ether / IPv6 / ICMPv6ND_NS / ICMPv6 Neighbor Discovery Option - Source Link-Layer Address c0:8f:20:38:6d:91
Ether / IPv6 / ICMPv6ND_NA / ICMPv6 Neighbor Discovery Option - Destination Link-Layer Address 28:d0:43:85:3d:2b
Ether / IP / TCP 192.168.29.94:54600 > 13.89.179.11:https PA / Raw
Ether / IP / TCP 192.168.29.94:54600 > 13.89.179.11:https A / Raw
Ether / IP / TCP 192.168.29.94:54600 > 13.89.179.11:https A / Raw
Ether / IP / TCP 192.168.29.94:54600 > 13.89.179.11:https PA / Raw
Ether / IP / TCP 13.89.179.11:https > 192.168.29.94:54600 A / Padding
Ether / IP / TCP 13.89.179.11:https > 192.168.29.94:54600 A / Padding
Ether / IP / TCP 13.89.179.11:https > 192.168.29.94:54600 PA / Raw
Ether / IP / TCP 192.168.29.94:54600 > 13.89.179.11:https A
Ether / IP / TCP 13.89.179.11:https > 192.168.29.94:54600 PA / Raw
Ether / IP / TCP 192.168.29.94:54600 > 13.89.179.11:https A
Ether / IPv6 / ICMPv6ND_NS / ICMPv6 Neighbor Discovery Option - Source Link-Layer Address c0:8f:20:38:6d:91
Ether / IPv6 / ICMPv6ND_NA / ICMPv6 Neighbor Discovery Option - Destination Link-Layer Address 28:d0:43:85:3d:2b
Ether / IP / UDP / DNS Qry b'firestore.googleapis.com.'
Ether / IP / UDP / DNS Qry b'firestore.googleapis.com.'
Ether / IP / UDP / DNS Qry b'firestore.googleapis.com.'
Ether / IP / UDP / DNS Ans 2404:6800:4000:101d::5f
Ether / IP / UDP / DNS Ans 142.251.223.10
Ether / IPv6 / UDP 2405:201:c006:90ae:4d4e:b515:9462:e106:61248 > 2404:6800:4000:101d::5f:https / Raw
Ether / IPv6 / UDP 2405:201:c006:90ae:4d4e:b515:9462:e106:61248 > 2404:6800:4000:101d::5f:https / Raw
Ether / IP / UDP / DNS Ans
Ether / IPv6 / UDP 2404:6800:4000:101d::5f:https > 2405:201:c006:90ae:4d4e:b515:9462:e106:61248 / Raw
Ether / IPv6 / UDP 2404:6800:4000:101d::5f:https > 2405:201:c006:90ae:4d4e:b515:9462:e106:61248 / Raw
Ether / IPv6 / UDP 2404:6800:4000:101d::5f:https > 2405:201:c006:90ae:4d4e:b515:9462:e106:61248 / Raw
Ether / IPv6 / UDP 2405:201:c006:90ae:4d4e:b515:9462:e106:61248 > 2404:6800:4000:101d::5f:https / Raw
Ether / IPv6 / UDP 2405:201:c006:90ae:4d4e:b515:9462:e106:61248 > 2404:6800:4000:101d::5f:https / Raw
Ether / IPv6 / UDP 2405:201:c006:90ae:4d4e:b515:9462:e106:61248 > 2404:6800:4000:101d::5f:https / Raw
Ether / IPv6 / UDP 2405:201:c006:90ae:4d4e:b515:9462:e106:61248 > 2404:6800:4000:101d::5f:https / Raw
Ether / IPv6 / UDP 2405:201:c006:90ae:4d4e:b515:9462:e106:61248 > 2404:6800:4000:101d::5f:https / Raw
Ether / IPv6 / UDP 2404:6800:4000:101d::5f:https > 2405:201:c006:90ae:4d4e:b515:9462:e106:61248 / Raw
Ether / IPv6 / UDP 2404:6800:4000:101d::5f:https > 2405:201:c006:90ae:4d4e:b515:9462:e106:61248 / Raw
Ether / IPv6 / UDP 2404:6800:4000:101d::5f:https > 2405:201:c006:90ae:4d4e:b515:9462:e106:61248 / Raw
Ether / IPv6 / UDP 2404:6800:4000:101d::5f:https > 2405:201:c006:90ae:4d4e:b515:9462:e106:61248 / Raw
Ether / IPv6 / UDP 2404:6800:4000:101d::5f:https > 2405:201:c006:90ae:4d4e:b515:9462:e106:61248 / Raw
Ether / IPv6 / UDP 2404:6800:4000:101d::5f:https > 2405:201:c006:90ae:4d4e:b515:9462:e106:61248 / Raw
Ether / IPv6 / UDP 2405:201:c006:90ae:4d4e:b515:9462:e106:61248 > 2404:6800:4000:101d::5f:https / Raw
Ether / IPv6 / UDP 2405:201:c006:90ae:4d4e:b515:9462:e106:61248 > 2404:6800:4000:101d::5f:https / Raw
Ether / IPv6 / UDP 2405:201:c006:90ae:4d4e:b515:9462:e106:61248 > 2404:6800:4000:101d::5f:https / Raw
Ether / IPv6 / UDP 2404:6800:4000:101d::5f:https > 2405:201:c006:90ae:4d4e:b515:9462:e106:61248 / Raw
Ether / IPv6 / UDP 2405:201:c006:90ae:4d4e:b515:9462:e106:61248 > 2404:6800:4000:101d::5f:https / Raw
Ether / IPv6 / UDP 2404:6800:4000:101d::5f:https > 2405:201:c006:90ae:4d4e:b515:9462:e106:61248 / Raw
Ether / IPv6 / UDP 2404:6800:4000:101d::5f:https > 2405:201:c006:90ae:4d4e:b515:9462:e106:61248 / Raw
Ether / IPv6 / UDP 2404:6800:4000:101d::5f:https > 2405:201:c006:90ae:4d4e:b515:9462:e106:61248 / Raw
Ether / IPv6 / UDP 2405:201:c006:90ae:4d4e:b515:9462:e106:61248 > 2404:6800:4000:101d::5f:https / Raw
Ether / IPv6 / UDP 2404:6800:4000:101d::5f:https > 2405:201:c006:90ae:4d4e:b515:9462:e106:61248 / Raw
Ether / IPv6 / UDP 2405:201:c006:90ae:4d4e:b515:9462:e106:61248 > 2404:6800:4000:101d::5f:https / Raw
Ether / IPv6 / UDP 2405:201:c006:90ae:4d4e:b515:9462:e106:61248 > 2404:6800:4000:101d::5f:https / Raw
Ether / IPv6 / UDP 2405:201:c006:90ae:4d4e:b515:9462:e106:61248 > 2404:6800:4000:101d::5f:https / Raw
Ether / IPv6 / UDP 2405:201:c006:90ae:4d4e:b515:9462:e106:61248 > 2404:6800:4000:101d::5f:https / Raw
Ether / IPv6 / UDP 2404:6800:4000:101d::5f:https > 2405:201:c006:90ae:4d4e:b515:9462:e106:61248 / Raw
Ether / IPv6 / UDP 2404:6800:4000:101d::5f:https > 2405:201:c006:90ae:4d4e:b515:9462:e106:61248 / Raw
Ether / IPv6 / UDP 2404:6800:4000:101d::5f:https > 2405:201:c006:90ae:4d4e:b515:9462:e106:61248 / Raw
Ether / IPv6 / UDP 2404:6800:4000:101d::5f:https > 2405:201:c006:90ae:4d4e:b515:9462:e106:61248 / Raw
Ether / IPv6 / UDP 2405:201:c006:90ae:4d4e:b515:9462:e106:61248 > 2404:6800:4000:101d::5f:https / Raw
Ether / IPv6 / UDP 2405:201:c006:90ae:4d4e:b515:9462:e106:61248 > 2404:6800:4000:101d::5f:https / Raw
Ether / IPv6 / UDP 2404:6800:4000:101d::5f:https > 2405:201:c006:90ae:4d4e:b515:9462:e106:61248 / Raw
[23:49:08] Ether / IP / TCP 20.42.73.28:https > 192.168.29.94:61930 A | Size: 54 bytes
[23:49:08] Ether / IPv6 / TCP 2a01:4ff:1f0:ca4b::1:https > 2405:201:c006:90ae:4d4e:b515:9462:e106:54646 PA / Raw | Size: 7274 bytes
[23:49:08] Ether / IPv6 / TCP 2405:201:c006:90ae:4d4e:b515:9462:e106:54646 > 2a01:4ff:1f0:ca4b::1:https A | Size: 74 bytes
[23:49:08] Ether / IPv6 / TCP 2a01:4ff:1f0:ca4b::1:https > 2405:201:c006:90ae:4d4e:b515:9462:e106:54646 A / Raw | Size: 1514 bytes
[23:49:08] Ether / IPv6 / TCP 2a01:4ff:1f0:ca4b::1:https > 2405:201:c006:90ae:4d4e:b515:9462:e106:54646 PA / Raw | Size: 21674 bytes
[23:49:08] Ether / IPv6 / TCP 2405:201:c006:90ae:4d4e:b515:9462:e106:54646 > 2a01:4ff:1f0:ca4b::1:https A | Size: 74 bytes
[23:49:08] Ether / IPv6 / TCP 2a01:4ff:1f0:ca4b::1:https > 2405:201:c006:90ae:4d4e:b515:9462:e106:54646 PA / Raw | Size: 7274 bytes
[23:49:08] Ether / IPv6 / TCP 2405:201:c006:90ae:4d4e:b515:9462:e106:54646 > 2a01:4ff:1f0:ca4b::1:https A | Size: 74 bytes
[23:49:08] Ether / IPv6 / TCP 2a01:4ff:1f0:ca4b::1:https > 2405:201:c006:90ae:4d4e:b515:9462:e106:54646 PA / Raw | Size: 20234 bytes
[23:49:08] Ether / IPv6 / TCP 2405:201:c006:90ae:4d4e:b515:9462:e106:54646 > 2a01:4ff:1f0:ca4b::1:https A | Size: 74 bytes
[23:49:08] Ether / IPv6 / TCP 2a01:4ff:1f0:ca4b::1:https > 2405:201:c006:90ae:4d4e:b515:9462:e106:54646 PA / Raw | Size: 4394 bytes
[23:49:08] Ether / IPv6 / TCP 2405:201:c006:90ae:4d4e:b515:9462:e106:54646 > 2a01:4ff:1f0:ca4b::1:https A | Size: 74 bytes
[23:49:08] Ether / IPv6 / TCP 2a01:4ff:1f0:ca4b::1:https > 2405:201:c006:90ae:4d4e:b515:9462:e106:54646 A / Raw | Size: 1514 bytes
[23:49:08] Ether / IPv6 / TCP 2a01:4ff:1f0:ca4b::1:https > 2405:201:c006:90ae:4d4e:b515:9462:e106:54646 PA / Raw | Size: 1514 bytes
[23:49:08] Ether / IPv6 / TCP 2a01:4ff:1f0:ca4b::1:https > 2405:201:c006:90ae:4d4e:b515:9462:e106:54646 A / Raw | Size: 1514 bytes
[23:49:08] Ether / IPv6 / TCP 2a01:4ff:1f0:ca4b::1:https > 2405:201:c006:90ae:4d4e:b515:9462:e106:54646 PA / Raw | Size: 1514 bytes
[23:49:08] Ether / IPv6 / TCP 2a01:4ff:1f0:ca4b::1:https > 2405:201:c006:90ae:4d4e:b515:9462:e106:54646 A / Raw | Size: 1514 bytes
[23:49:08] Ether / IPv6 / TCP 2a01:4ff:1f0:ca4b::1:https > 2405:201:c006:90ae:4d4e:b515:9462:e106:54646 PA / Raw | Size: 1514 bytes
[23:49:08] Ether / IPv6 / TCP 2a01:4ff:1f0:ca4b::1:https > 2405:201:c006:90ae:4d4e:b515:9462:e106:54646 A / Raw | Size: 1514 bytes
[23:49:08] Ether / IPv6 / TCP 2a01:4ff:1f0:ca4b::1:https > 2405:201:c006:90ae:4d4e:b515:9462:e106:54646 PA / Raw | Size: 1514 bytes
[23:49:08] Ether / IPv6 / TCP 2a01:4ff:1f0:ca4b::1:https > 2405:201:c006:90ae:4d4e:b515:9462:e106:54646 A / Raw | Size: 1514 bytes
[23:49:08] Ether / IPv6 / TCP 2a01:4ff:1f0:ca4b::1:https > 2405:201:c006:90ae:4d4e:b515:9462:e106:54646 PA / Raw | Size: 1514 bytes
[23:49:08] Ether / IPv6 / TCP 2a01:4ff:1f0:ca4b::1:https > 2405:201:c006:90ae:4d4e:b515:9462:e106:54646 A / Raw | Size: 1514 bytes
[23:49:08] Ether / IPv6 / TCP 2a01:4ff:1f0:ca4b::1:https > 2405:201:c006:90ae:4d4e:b515:9462:e106:54646 PA / Raw | Size: 1514 bytes
[23:49:08] Ether / IPv6 / TCP 2a01:4ff:1f0:ca4b::1:https > 2405:201:c006:90ae:4d4e:b515:9462:e106:54646 A / Raw | Size: 1514 bytes
[23:49:08] Ether / IPv6 / TCP 2a01:4ff:1f0:ca4b::1:https > 2405:201:c006:90ae:4d4e:b515:9462:e106:54646 PA / Raw | Size: 1514 bytes
[23:49:08] Ether / IPv6 / TCP 2a01:4ff:1f0:ca4b::1:https > 2405:201:c006:90ae:4d4e:b515:9462:e106:54646 A / Raw | Size: 1514 bytes
[23:49:08] Ether / IPv6 / TCP 2a01:4ff:1f0:ca4b::1:https > 2405:201:c006:90ae:4d4e:b515:9462:e106:54646 PA / Raw | Size: 1514 bytes
[23:49:08] Ether / IPv6 / TCP 2405:201:c006:90ae:4d4e:b515:9462:e106:54646 > 2a01:4ff:1f0:ca4b::1:https A | Size: 74 bytes
[23:49:08] Ether / IPv6 / TCP 2a01:4ff:1f0:ca4b::1:https > 2405:201:c006:90ae:4d4e:b515:9462:e106:54646 A / Raw | Size: 1514 bytes
[23:49:08] Ether / IPv6 / TCP 2a01:4ff:1f0:ca4b::1:https > 2405:201:c006:90ae:4d4e:b515:9462:e106:54646 PA / Raw | Size: 1514 bytes
[23:49:08] Ether / IPv6 / TCP 2a01:4ff:1f0:ca4b::1:https > 2405:201:c006:90ae:4d4e:b515:9462:e106:54646 A / Raw | Size: 1514 bytes
[23:49:08] Ether / IPv6 / TCP 2a01:4ff:1f0:ca4b::1:https > 2405:201:c006:90ae:4d4e:b515:9462:e106:54646 PA / Raw | Size: 1514 bytes
[23:49:08] Ether / IPv6 / TCP 2a01:4ff:1f0:ca4b::1:https > 2405:201:c006:90ae:4d4e:b515:9462:e106:54646 A / Raw | Size: 1514 bytes
[23:49:08] Ether / IPv6 / TCP 2a01:4ff:1f0:ca4b::1:https > 2405:201:c006:90ae:4d4e:b515:9462:e106:54646 PA / Raw | Size: 1514 bytes
[23:49:08] Ether / IPv6 / TCP 2405:201:c006:90ae:4d4e:b515:9462:e106:54646 > 2a01:4ff:1f0:ca4b::1:https A | Size: 74 bytes
[23:49:08] Ether / IPv6 / TCP 2a01:4ff:1f0:ca4b::1:https > 2405:201:c006:90ae:4d4e:b515:9462:e106:54646 PA / Raw | Size: 7274 bytes
[23:49:08] Ether / IPv6 / TCP 2405:201:c006:90ae:4d4e:b515:9462:e106:54646 > 2a01:4ff:1f0:ca4b::1:https A | Size: 74 bytes
[23:49:08] Ether / IPv6 / TCP 2a01:4ff:1f0:ca4b::1:https > 2405:201:c006:90ae:4d4e:b515:9462:e106:54646 PA / Raw | Size: 23114 bytes
[23:49:08] Ether / IPv6 / TCP 2405:201:c006:90ae:4d4e:b515:9462:e106:54646 > 2a01:4ff:1f0:ca4b::1:https A | Size: 74 bytes
[23:49:08] Ether / IPv6 / TCP 2a01:4ff:1f0:ca4b::1:https > 2405:201:c006:90ae:4d4e:b515:9462:e106:54646 PA / Raw | Size: 11594 bytes
[23:49:08] Ether / IPv6 / TCP 2405:201:c006:90ae:4d4e:b515:9462:e106:54646 > 2a01:4ff:1f0:ca4b::1:https A | Size: 74 bytes
[23:49:08] Ether / IPv6 / TCP 2a01:4ff:1f0:ca4b::1:https > 2405:201:c006:90ae:4d4e:b515:9462:e106:54646 PA / Raw | Size: 23114 bytes
[23:49:08] Ether / IPv6 / TCP 2405:201:c006:90ae:4d4e:b515:9462:e106:54646 > 2a01:4ff:1f0:ca4b::1:https A | Size: 74 bytes
[23:49:08] Ether / IPv6 / TCP 2a01:4ff:1f0:ca4b::1:https > 2405:201:c006:90ae:4d4e:b515:9462:e106:54646 PA / Raw | Size: 11594 bytes
[23:49:08] Ether / IPv6 / TCP 2405:201:c006:90ae:4d4e:b515:9462:e106:54646 > 2a01:4ff:1f0:ca4b::1:https A | Size: 74 bytes
[23:49:08] Ether / IPv6 / TCP 2a01:4ff:1f0:ca4b::1:https > 2405:201:c006:90ae:4d4e:b515:9462:e106:54646 PA / Raw | Size: 18794 bytes
[23:49:08] Ether / IPv6 / TCP 2405:201:c006:90ae:4d4e:b515:9462:e106:54646 > 2a01:4ff:1f0:ca4b::1:https A | Size: 74 bytes
[23:49:08] Ether / IPv6 / TCP 2a01:4ff:1f0:ca4b::1:https > 2405:201:c006:90ae:4d4e:b515:9462:e106:54646 PA / Raw | Size: 7274 bytes
[23:49:09] Ether / IPv6 / TCP 2405:201:c006:90ae:4d4e:b515:9462:e106:54646 > 2a01:4ff:1f0:ca4b::1:https A | Size: 74 bytes
[23:49:09] Ether / IPv6 / TCP 2a01:4ff:1f0:ca4b::1:https > 2405:201:c006:90ae:4d4e:b515:9462:e106:54646 A / Raw | Size: 1514 bytes
[23:49:09] Ether / IPv6 / TCP 2a01:4ff:1f0:ca4b::1:https > 2405:201:c006:90ae:4d4e:b515:9462:e106:54646 PA / Raw | Size: 21674 bytes
[23:49:09] Ether / IPv6 / TCP 2405:201:c006:90ae:4d4e:b515:9462:e106:54646 > 2a01:4ff:1f0:ca4b::1:https A | Size: 74 bytes
[23:49:09] Ether / IPv6 / TCP 2a01:4ff:1f0:ca4b::1:https > 2405:201:c006:90ae:4d4e:b515:9462:e106:54646 PA / Raw | Size: 4394 bytes
[23:49:09] Ether / IPv6 / TCP 2405:201:c006:90ae:4d4e:b515:9462:e106:54646 > 2a01:4ff:1f0:ca4b::1:https A | Size: 74 bytes
[23:49:09] Ether / IPv6 / TCP 2a01:4ff:1f0:ca4b::1:https > 2405:201:c006:90ae:4d4e:b515:9462:e106:54646 PA / Raw | Size: 23114 bytes
[23:49:09] Ether / IPv6 / TCP 2405:201:c006:90ae:4d4e:b515:9462:e106:54646 > 2a01:4ff:1f0:ca4b::1:https A | Size: 74 bytes
[23:49:09] Ether / IPv6 / TCP 2a01:4ff:1f0:ca4b::1:https > 2405:201:c006:90ae:4d4e:b515:9462:e106:54646 PA / Raw | Size: 7274 bytes
[23:49:09] Ether / IPv6 / TCP 2405:201:c006:90ae:4d4e:b515:9462:e106:54646 > 2a01:4ff:1f0:ca4b::1:https A | Size: 74 bytes
[23:49:09] Ether / IPv6 / TCP 2a01:4ff:1f0:ca4b::1:https > 2405:201:c006:90ae:4d4e:b515:9462:e106:54646 PA / Raw | Size: 23114 bytes
[23:49:09] Ether / IPv6 / TCP 2405:201:c006:90ae:4d4e:b515:9462:e106:54646 > 2a01:4ff:1f0:ca4b::1:https A | Size: 74 bytes
[23:49:09] Ether / IPv6 / TCP 2a01:4ff:1f0:ca4b::1:https > 2405:201:c006:90ae:4d4e:b515:9462:e106:54646 PA / Raw | Size: 10154 bytes
[23:49:09] Ether / IPv6 / TCP 2405:201:c006:90ae:4d4e:b515:9462:e106:54646 > 2a01:4ff:1f0:ca4b::1:https A | Size: 74 bytes
[23:49:09] Ether / IPv6 / TCP 2a01:4ff:1f0:ca4b::1:https > 2405:201:c006:90ae:4d4e:b515:9462:e106:54646 A / Raw | Size: 1514 bytes
[23:49:09] Ether / IPv6 / TCP 2a01:4ff:1f0:ca4b::1:https > 2405:201:c006:90ae:4d4e:b515:9462:e106:54646 PA / Raw | Size: 5834 bytes
[23:49:09] Ether / IPv6 / TCP 2405:201:c006:90ae:4d4e:b515:9462:e106:54646 > 2a01:4ff:1f0:ca4b::1:https A | Size: 74 bytes
[23:49:09] Ether / IPv6 / TCP 2a01:4ff:1f0:ca4b::1:https > 2405:201:c006:90ae:4d4e:b515:9462:e106:54646 PA / Raw | Size: 23114 bytes
[23:49:09] Ether / IPv6 / TCP 2405:201:c006:90ae:4d4e:b515:9462:e106:54646 > 2a01:4ff:1f0:ca4b::1:https A | Size: 74 bytes
[23:49:09] Ether / IPv6 / TCP 2a01:4ff:1f0:ca4b::1:https > 2405:201:c006:90ae:4d4e:b515:9462:e106:54646 PA / Raw | Size: 4394 bytes
[23:49:09] Ether / IPv6 / TCP 2405:201:c006:90ae:4d4e:b515:9462:e106:54646 > 2a01:4ff:1f0:ca4b::1:https A | Size: 74 bytes
[23:49:09] Ether / IPv6 / TCP 2a01:4ff:1f0:ca4b::1:https > 2405:201:c006:90ae:4d4e:b515:9462:e106:54646 PA / Raw | Size: 23114 bytes
[23:49:09] Ether / IPv6 / TCP 2405:201:c006:90ae:4d4e:b515:9462:e106:54646 > 2a01:4ff:1f0:ca4b::1:https A | Size: 74 bytes
[23:49:09] Ether / IPv6 / TCP 2a01:4ff:1f0:ca4b::1:https > 2405:201:c006:90ae:4d4e:b515:9462:e106:54646 PA / Raw | Size: 4394 bytes
[23:49:09] Ether / IPv6 / TCP 2405:201:c006:90ae:4d4e:b515:9462:e106:54646 > 2a01:4ff:1f0:ca4b::1:https A | Size: 74 bytes
[23:49:09] Ether / IPv6 / TCP 2a01:4ff:1f0:ca4b::1:https > 2405:201:c006:90ae:4d4e:b515:9462:e106:54646 PA / Raw | Size: 23114 bytes
[23:49:09] Ether / IPv6 / TCP 2405:201:c006:90ae:4d4e:b515:9462:e106:54646 > 2a01:4ff:1f0:ca4b::1:https A | Size: 74 bytes
[23:49:09] Ether / IPv6 / TCP 2a01:4ff:1f0:ca4b::1:https > 2405:201:c006:90ae:4d4e:b515:9462:e106:54646 PA / Raw | Size: 10154 bytes
[23:49:09] Ether / IPv6 / TCP 2405:201:c006:90ae:4d4e:b515:9462:e106:54646 > 2a01:4ff:1f0:ca4b::1:https A | Size: 74 bytes
[23:49:09] Ether / IPv6 / TCP 2a01:4ff:1f0:ca4b::1:https > 2405:201:c006:90ae:4d4e:b515:9462:e106:54646 PA / Raw | Size: 4394 bytes
[23:49:09] Ether / IPv6 / TCP 2405:201:c006:90ae:4d4e:b515:9462:e106:54646 > 2a01:4ff:1f0:ca4b::1:https A | Size: 74 bytes
[23:49:09] Ether / IPv6 / UDP / DNS Qry b'mobile.events.data.microsoft.com.' | Size: 112 bytes
[23:49:09] Ether / IPv6 / UDP / DNS Qry b'mobile.events.data.microsoft.com.' | Size: 112 bytes
[23:49:09] Ether / IPv6 / UDP / DNS Ans b'mobile.events.data.trafficmanager.net.' | Size: 219 bytes
[23:49:09] Ether / IPv6 / UDP / DNS Ans b'mobile.events.data.trafficmanager.net.' | Size: 232 bytes
[23:49:09] Ether / IPv6 / UDP / DNS Qry b'mobile.events.data.microsoft.com.' | Size: 112 bytes
[23:49:09] Ether / IP / TCP 192.168.29.94:64189 > 20.42.73.31:https S | Size: 66 bytes
[23:49:09] Ether / IPv6 / UDP / DNS Ans b'mobile.events.data.trafficmanager.net.' | Size: 219 bytes
[23:49:09] Ether / IPv6 / UDP / DNS Qry b'mobile.events.data.microsoft.com.' | Size: 112 bytes
[23:49:09] Ether / IP / TCP 192.168.29.94:64190 > 20.42.73.31:https S | Size: 66 bytes
[23:49:09] Ether / IP / UDP / DNS Qry b'mobile.events.data.microsoft.com.' | Size: 92 bytes
[23:49:09] Ether / IPv6 / UDP / DNS Ans b'mobile.events.data.trafficmanager.net.' | Size: 219 bytes
[23:49:09] Ether / IP / UDP / DNS Ans b'mobile.events.data.trafficmanager.net.' | Size: 199 bytes
[23:49:09] Ether / IPv6 / TCP 2a01:4ff:1f0:ca4b::1:https > 2405:201:c006:90ae:4d4e:b515:9462:e106:54646 PA / Raw | Size: 7274 bytes
[23:49:09] Ether / IPv6 / TCP 2405:201:c006:90ae:4d4e:b515:9462:e106:54646 > 2a01:4ff:1f0:ca4b::1:https A | Size: 74 bytes
[23:49:09] Ether / IPv6 / UDP / DNS Qry b'mobile.events.data.microsoft.com.' | Size: 112 bytes
[23:49:09] Ether / IP / UDP / DNS Qry b'mobile.events.data.microsoft.com.' | Size: 92 bytes
[23:49:09] Ether / IPv6 / UDP / DNS Ans b'mobile.events.data.trafficmanager.net.' | Size: 219 bytes
[23:49:09] Ether / IP / UDP / DNS Ans b'mobile.events.data.trafficmanager.net.' | Size: 199 bytes
[23:49:09] Ether / IPv6 / TCP 2a01:4ff:1f0:ca4b::1:https > 2405:201:c006:90ae:4d4e:b515:9462:e106:54646 PA / Raw | Size: 20234 bytes
[23:49:09] Ether / IPv6 / TCP 2405:201:c006:90ae:4d4e:b515:9462:e106:54646 > 2a01:4ff:1f0:ca4b::1:https A | Size: 74 bytes
[23:49:09] Ether / IPv6 / TCP 2a01:4ff:1f0:ca4b::1:https > 2405:201:c006:90ae:4d4e:b515:9462:e106:54646 PA / Raw | Size: 4394 bytes
[23:49:09] Ether / IPv6 / TCP 2405:201:c006:90ae:4d4e:b515:9462:e106:54646 > 2a01:4ff:1f0:ca4b::1:https A | Size: 74 bytes
[23:49:09] Ether / IPv6 / UDP / DNS Qry b'mobile.events.data.microsoft.com.' | Size: 112 bytes
[23:49:09] Ether / IPv6 / TCP 2a01:4ff:1f0:ca4b::1:https > 2405:201:c006:90ae:4d4e:b515:9462:e106:54646 PA / Raw | Size: 23114 bytes
[23:49:09] Ether / IPv6 / TCP 2405:201:c006:90ae:4d4e:b515:9462:e106:54646 > 2a01:4ff:1f0:ca4b::1:https A | Size: 74 bytes
[23:49:09] Ether / IPv6 / TCP 2a01:4ff:1f0:ca4b::1:https > 2405:201:c006:90ae:4d4e:b515:9462:e106:54646 PA / Raw | Size: 7274 bytes
[23:49:09] Ether / IPv6 / TCP 2405:201:c006:90ae:4d4e:b515:9462:e106:54646 > 2a01:4ff:1f0:ca4b::1:https A | Size: 74 bytes
[23:49:09] Ether / IPv6 / TCP 2a01:4ff:1f0:ca4b::1:https > 2405:201:c006:90ae:4d4e:b515:9462:e106:54646 PA / Raw | Size: 23114 bytes
[23:49:09] Ether / IPv6 / TCP 2405:201:c006:90ae:4d4e:b515:9462:e106:54646 > 2a01:4ff:1f0:ca4b::1:https A | Size: 74 bytes
[23:49:09] Ether / IPv6 / TCP 2a01:4ff:1f0:ca4b::1:https > 2405:201:c006:90ae:4d4e:b515:9462:e106:54646 PA / Raw | Size: 2954 bytes
[23:49:09] Ether / IPv6 / TCP 2405:201:c006:90ae:4d4e:b515:9462:e106:54646 > 2a01:4ff:1f0:ca4b::1:https A | Size: 74 bytes
[23:49:09] Ether / IPv6 / UDP / DNS Ans b'mobile.events.data.trafficmanager.net.' | Size: 219 bytes
[23:49:09] Ether / IPv6 / TCP 2a01:4ff:1f0:ca4b::1:https > 2405:201:c006:90ae:4d4e:b515:9462:e106:54646 PA / Raw | Size: 13034 bytes
[23:49:09] Ether / IPv6 / TCP 2405:201:c006:90ae:4d4e:b515:9462:e106:54646 > 2a01:4ff:1f0:ca4b::1:https A | Size: 74 bytes
[23:49:09] Ether / IPv6 / UDP / DNS Qry b'mobile.events.data.microsoft.com.' | Size: 112 bytes
[23:49:09] Ether / IP / TCP 192.168.29.94:64191 > 20.42.73.31:https S | Size: 66 bytes
[23:49:09] Ether / IP / TCP 192.168.29.94:64192 > 20.42.73.31:https S | Size: 66 bytes
[23:49:09] Ether / IP / TCP 192.168.29.94:64193 > 20.42.73.31:https S | Size: 66 bytes
[23:49:09] Ether / IP / TCP 192.168.29.94:64194 > 20.42.73.31:https S | Size: 66 bytes
[23:49:09] Ether / IP / TCP 192.168.29.94:64195 > 20.42.73.31:https S | Size: 66 bytes
[23:49:09] Ether / IPv6 / UDP / DNS Ans b'mobile.events.data.trafficmanager.net.' | Size: 219 bytes
[23:49:09] Ether / IPv6 / UDP / DNS Qry b'mobile.events.data.microsoft.com.' | Size: 112 bytes
[23:49:09] Ether / IP / TCP 20.42.73.31:https > 192.168.29.94:64189 SA | Size: 66 bytes
[23:49:09] Ether / IP / TCP 192.168.29.94:64189 > 20.42.73.31:https A | Size: 54 bytes
[23:49:09] Ether / IPv6 / UDP / DNS Ans b'mobile.events.data.trafficmanager.net.' | Size: 219 bytes
[23:49:09] Ether / IP / TCP 20.42.73.31:https > 192.168.29.94:64190 SA | Size: 66 bytes
[23:49:09] Ether / IP / TCP 192.168.29.94:64190 > 20.42.73.31:https A | Size: 54 bytes
[23:49:09] Ether / IPv6 / UDP / DNS Qry b'mobile.events.data.microsoft.com.' | Size: 112 bytes
[23:49:09] Ether / IPv6 / UDP / DNS Ans b'mobile.events.data.trafficmanager.net.' | Size: 219 bytes
[23:49:09] Ether / IPv6 / TCP 2a01:4ff:1f0:ca4b::1:https > 2405:201:c006:90ae:4d4e:b515:9462:e106:54646 PA / Raw | Size: 7274 bytes
[23:49:09] Ether / IPv6 / TCP 2405:201:c006:90ae:4d4e:b515:9462:e106:54646 > 2a01:4ff:1f0:ca4b::1:https A | Size: 74 bytes
[23:49:09] Ether / IPv6 / UDP / DNS Qry b'mobile.events.data.microsoft.com.' | Size: 112 bytes
[23:49:09] Ether / IP / TCP 192.168.29.94:64196 > 20.42.73.31:https S | Size: 66 bytes
[23:49:09] Ether / IP / TCP 192.168.29.94:64197 > 20.42.73.31:https S | Size: 66 bytes
[23:49:09] Ether / IP / TCP 192.168.29.94:64198 > 20.42.73.31:https S | Size: 66 bytes
[23:49:09] Ether / IP / TCP 192.168.29.94:64189 > 20.42.73.31:https PA / Raw | Size: 571 bytes
[23:49:09] Ether / IP / TCP 192.168.29.94:64190 > 20.42.73.31:https PA / Raw | Size: 571 bytes
[23:49:09] Ether / IPv6 / UDP / DNS Ans b'mobile.events.data.trafficmanager.net.' | Size: 219 bytes
[23:49:09] Ether / IP / TCP 192.168.29.94:64199 > 20.42.73.31:https S | Size: 66 bytes
[23:49:09] Ether / IPv6 / TCP 2a01:4ff:1f0:ca4b::1:https > 2405:201:c006:90ae:4d4e:b515:9462:e106:54646 PA / Raw | Size: 23114 bytes
[23:49:09] Ether / IPv6 / TCP 2405:201:c006:90ae:4d4e:b515:9462:e106:54646 > 2a01:4ff:1f0:ca4b::1:https A | Size: 74 bytes
[23:49:09] Ether / IPv6 / TCP 2a01:4ff:1f0:ca4b::1:https > 2405:201:c006:90ae:4d4e:b515:9462:e106:54646 PA / Raw | Size: 5834 bytes
[23:49:09] Ether / IPv6 / TCP 2405:201:c006:90ae:4d4e:b515:9462:e106:54646 > 2a01:4ff:1f0:ca4b::1:https A | Size: 74 bytes
[23:49:09] Ether / IPv6 / TCP 2a01:4ff:1f0:ca4b::1:https > 2405:201:c006:90ae:4d4e:b515:9462:e106:54646 PA / Raw | Size: 23114 bytes
[23:49:09] Ether / IPv6 / TCP 2405:201:c006:90ae:4d4e:b515:9462:e106:54646 > 2a01:4ff:1f0:ca4b::1:https A | Size: 74 bytes
[23:49:09] Ether / IPv6 / TCP 2a01:4ff:1f0:ca4b::1:https > 2405:201:c006:90ae:4d4e:b515:9462:e106:54646 PA / Raw | Size: 7274 bytes
[23:49:09] Ether / IPv6 / TCP 2405:201:c006:90ae:4d4e:b515:9462:e106:54646 > 2a01:4ff:1f0:ca4b::1:https A | Size: 74 bytes
[23:49:09] Ether / IPv6 / TCP 2a01:4ff:1f0:ca4b::1:https > 2405:201:c006:90ae:4d4e:b515:9462:e106:54646 PA / Raw | Size: 23114 bytes
[23:49:09] Ether / IPv6 / TCP 2405:201:c006:90ae:4d4e:b515:9462:e106:54646 > 2a01:4ff:1f0:ca4b::1:https A | Size: 74 bytes
[23:49:09] Ether / IPv6 / TCP 2a01:4ff:1f0:ca4b::1:https > 2405:201:c006:90ae:4d4e:b515:9462:e106:54646 PA / Raw | Size: 5834 bytes
[23:49:09] Ether / IPv6 / TCP 2405:201:c006:90ae:4d4e:b515:9462:e106:54646 > 2a01:4ff:1f0:ca4b::1:https A | Size: 74 bytes
[23:49:09] Ether / IPv6 / TCP 2a01:4ff:1f0:ca4b::1:https > 2405:201:c006:90ae:4d4e:b515:9462:e106:54646 PA / Raw | Size: 7274 bytes
[23:49:09] Ether / IP / TCP 20.42.73.31:https > 192.168.29.94:64194 SA | Size: 66 bytes
[23:49:09] Ether / IPv6 / TCP 2405:201:c006:90ae:4d4e:b515:9462:e106:54646 > 2a01:4ff:1f0:ca4b::1:https A | Size: 74 bytes
[23:49:09] Ether / IP / TCP 192.168.29.94:64194 > 20.42.73.31:https A | Size: 54 bytes
[23:49:09] Ether / IP / TCP 192.168.29.94:64194 > 20.42.73.31:https PA / Raw | Size: 571 bytes
[23:49:09] Ether / IP / TCP 20.42.73.31:https > 192.168.29.94:64193 SA | Size: 66 bytes
[23:49:09] Ether / IP / TCP 20.42.73.31:https > 192.168.29.94:64192 SA | Size: 66 bytes
[23:49:09] Ether / IP / TCP 20.42.73.31:https > 192.168.29.94:64195 SA | Size: 66 bytes
[23:49:09] Ether / IP / TCP 20.42.73.31:https > 192.168.29.94:64191 SA | Size: 66 bytes
[23:49:09] Ether / IP / TCP 192.168.29.94:64193 > 20.42.73.31:https A | Size: 54 bytes
[23:49:09] Ether / IP / TCP 192.168.29.94:64192 > 20.42.73.31:https A | Size: 54 bytes
[23:49:09] Ether / IP / TCP 192.168.29.94:64195 > 20.42.73.31:https A | Size: 54 bytes
[23:49:09] Ether / IP / TCP 192.168.29.94:64191 > 20.42.73.31:https A | Size: 54 bytes
[23:49:09] Ether / IP / TCP 192.168.29.94:64192 > 20.42.73.31:https PA / Raw | Size: 571 bytes
